{
  "version": "1.0.0",
  "languageCode": "es-es",
  "languageName": "Español (España)",
  "programmingLanguage": "PortugolStudio",
  "translations": {
    "0": "entero",
    "1": "real",
    "2": "caracter",
    "3": "cadena",
    "4": "logico",
    "5": "vacio",
    "6": "si",
    "7": "sino",
    "8": "mientras",
    "9": "haga",
    "10": "para",
    "11": "segun",
    "12": "caso",
    "13": "defecto",
    "14": "rompa",
    "15": "retorne",
    "16": "programa",
    "17": "funcion",
    "18": "const",
    "19": "incluya",
    "20": "biblioteca",
    "21": "y",
    "22": "o",
    "23": "no",
    "24": "verdadero",
    "25": "falso"
  }
}
