{
  "version": "1.0.0",
  "languageCode": "en-us",
  "languageName": "English (United States)",
  "programmingLanguage": "VisuAlg",
  "translations": {
    "0": "algorithm",
    "1": "endalgorithm",
    "2": "var",
    "3": "begin",
    "4": "integer",
    "5": "real",
    "6": "character",
    "7": "logical",
    "8": "array",
    "9": "write",
    "10": "writeln",
    "11": "read",
    "12": "if",
    "13": "then",
    "14": "else",
    "15": "endif",
    "16": "for",
    "17": "from",
    "18": "to",
    "19": "do",
    "20": "endfor",
    "21": "while",
    "22": "endwhile",
    "23": "repeat",
    "24": "endrepeat",
    "25": "and",
    "26": "or",
    "27": "not",
    "28": "div",
    "29": "mod",
    "30": "true",
    "31": "false",
    "32": "procedure",
    "33": "endprocedure",
    "34": "function",
    "35": "endfunction",
    "36": "return",
    "37": "case",
    "38": "when",
    "39": "otherwise",
    "40": "endcase",
    "41": "constant",
    "42": "interrupt",
    "43": "xor",
    "44": "clearscreen",
    "45": "pause",
    "46": "random",
    "47": "debug"
  }
}
