{
  "version": "1.0.0",
  "languageCode": "pt-br-ascii",
  "languageName": "Português (Brasil, ASCII)",
  "programmingLanguage": "Python",
  "translations": {
    "0": "falso",
    "1": "nulo",
    "2": "verdadeiro",
    "3": "logicoe",
    "4": "como",
    "5": "afirmar",
    "6": "assincrono",
    "7": "aguardar",
    "8": "parar",
    "9": "classe",
    "10": "continuar",
    "11": "definir",
    "12": "deletar",
    "13": "senaose",
    "14": "senao",
    "15": "exceto",
    "16": "finalmente",
    "17": "para",
    "18": "de",
    "19": "global",
    "20": "se",
    "21": "importar",
    "22": "em",
    "23": "igual",
    "24": "lambda",
    "25": "naolocal",
    "26": "nao",
    "27": "logicoou",
    "28": "passar",
    "29": "lancar",
    "30": "retornar",
    "31": "tentar",
    "32": "enquanto",
    "33": "com",
    "34": "produzir"
  }
}
