{
  "version": "1.0.0",
  "languageCode": "zh-cn",
  "languageName": "中文 (中国)",
  "programmingLanguage": "PortugolStudio",
  "translations": {
    "0": "整数",
    "1": "实数",
    "2": "字符",
    "3": "字符串",
    "4": "逻辑",
    "5": "空",
    "6": "如果",
    "7": "否则",
    "8": "当",
    "9": "做",
    "10": "循环",
    "11": "选择",
    "12": "情况",
    "13": "默认",
    "14": "中断",
    "15": "返回",
    "16": "程序",
    "17": "函数",
    "18": "常量",
    "19": "包含",
    "20": "库",
    "21": "且",
    "22": "或",
    "23": "非",
    "24": "真",
    "25": "假"
  }
}
