{
  "version": "1.0.0",
  "languageCode": "zh-hans",
  "languageName": "中文 (简体)",
  "programmingLanguage": "CSharp",
  "translations": {
    "0": "抽象",
    "1": "作为",
    "2": "基类",
    "3": "布尔",
    "4": "跳出",
    "5": "字节",
    "6": "情况",
    "7": "捕获",
    "8": "字符",
    "9": "已检查",
    "10": "类",
    "11": "常量",
    "12": "继续",
    "13": "十进制",
    "14": "默认",
    "15": "委托",
    "16": "执行",
    "17": "双精度",
    "18": "否则",
    "19": "枚举",
    "20": "事件",
    "21": "显式",
    "22": "外部",
    "23": "假",
    "24": "最终",
    "25": "固定",
    "26": "浮点",
    "27": "循环",
    "28": "遍历",
    "29": "跳转",
    "30": "如果",
    "31": "隐式",
    "32": "在内",
    "33": "整数",
    "34": "接口",
    "35": "内部",
    "36": "是",
    "37": "锁定",
    "38": "长整数",
    "39": "命名空间",
    "40": "新建",
    "41": "空",
    "42": "对象",
    "43": "运算符",
    "44": "输出",
    "45": "重写",
    "46": "参数组",
    "47": "私有",
    "48": "受保护",
    "49": "公共",
    "50": "只读",
    "51": "引用",
    "52": "返回",
    "53": "有符号字节",
    "54": "密封",
    "55": "短整数",
    "56": "大小的",
    "57": "栈分配",
    "58": "静态",
    "59": "字符串",
    "60": "结构",
    "61": "选择",
    "62": "此",
    "63": "抛出",
    "64": "真",
    "65": "尝试",
    "66": "类型的",
    "67": "无符号整数",
    "68": "无符号长整数",
    "69": "未检查",
    "70": "不安全",
    "71": "无符号短整数",
    "72": "使用",
    "73": "虚拟",
    "74": "var",
    "75": "无返回",
    "76": "易变",
    "77": "当",
    "78": "异步",
    "79": "等待",
    "80": "产出",
    "81": "记录",
    "82": "部分",
    "83": "其中",
    "84": "动态",
    "85": "名称的",
    "86": "初始化",
    "87": "必需",
    "88": "全局"
  }
}
