{
  "version": "1.0.0",
  "languageCode": "es",
  "languageName": "Espanol",
  "programmingLanguage": "CSharp",
  "translations": {
    "0": "abstracto",
    "1": "como",
    "2": "base",
    "3": "booleano",
    "4": "romper",
    "5": "byte",
    "6": "caso",
    "7": "capturar",
    "8": "caracter",
    "9": "verificado",
    "10": "clase",
    "11": "constante",
    "12": "continuar",
    "13": "decimal",
    "14": "defecto",
    "15": "delegado",
    "16": "hacer",
    "17": "doble",
    "18": "sino",
    "19": "enumeracion",
    "20": "evento",
    "21": "explicito",
    "22": "externo",
    "23": "falso",
    "24": "finalmente",
    "25": "fijo",
    "26": "flotante",
    "27": "para",
    "28": "paracada",
    "29": "ira",
    "30": "si",
    "31": "implicito",
    "32": "en",
    "33": "entero",
    "34": "interfaz",
    "35": "interno",
    "36": "es",
    "37": "bloquear",
    "38": "largo",
    "39": "espacionombre",
    "40": "nuevo",
    "41": "nulo",
    "42": "objeto",
    "43": "operador",
    "44": "salida",
    "45": "sobrescribir",
    "46": "parametros",
    "47": "privado",
    "48": "protegido",
    "49": "publico",
    "50": "sololectura",
    "51": "referencia",
    "52": "retornar",
    "53": "byteconsenal",
    "54": "sellado",
    "55": "corto",
    "56": "tamanode",
    "57": "asignarenpila",
    "58": "estatico",
    "59": "texto",
    "60": "estructura",
    "61": "seleccionar",
    "62": "este",
    "63": "lanzar",
    "64": "verdadero",
    "65": "intentar",
    "66": "tipode",
    "67": "enterosinsigno",
    "68": "largosinsigno",
    "69": "noverificado",
    "70": "inseguro",
    "71": "cortosinsigno",
    "72": "usando",
    "73": "virtual",
    "74": "var",
    "75": "vacio",
    "76": "volatil",
    "77": "mientras",
    "78": "asincrono",
    "79": "esperar",
    "80": "producir",
    "81": "registro",
    "82": "parcial",
    "83": "donde",
    "84": "dinamico",
    "85": "nombrede",
    "86": "inicializador",
    "87": "requerido",
    "88": "global"
  }
}
