{
  "version": "1.0.0",
  "languageCode": "ar-sa",
  "languageName": "العربية (السعودية)",
  "programmingLanguage": "Python",
  "translations": {
    "0": "khata",
    "1": "lashay",
    "2": "sahih",
    "3": "wa",
    "4": "ka",
    "5": "takid",
    "6": "ghairmutazamin",
    "7": "intizar",
    "8": "qata",
    "9": "sinf",
    "10": "istimrar",
    "11": "tarif",
    "12": "hazf",
    "13": "wailakan",
    "14": "waila",
    "15": "istithna",
    "16": "akhiran",
    "17": "litakrar",
    "18": "min",
    "19": "amm",
    "20": "iza",
    "21": "istirad",
    "22": "fi",
    "23": "huwa",
    "24": "lambda",
    "25": "ghayrmahali",
    "26": "laysa",
    "27": "aw",
    "28": "tamrir",
    "29": "ithara",
    "30": "irja",
    "31": "muhawala",
    "32": "baynama",
    "33": "maa",
    "34": "intaj"
  }
}
