{
  "version": "1.0.0",
  "languageCode": "fr-fr",
  "languageName": "Français (France)",
  "programmingLanguage": "Python",
  "translations": {
    "0": "faux",
    "1": "aucun",
    "2": "vrai",
    "3": "logiqueet",
    "4": "comme",
    "5": "affirmer",
    "6": "asynchrone",
    "7": "attendre",
    "8": "arrêter",
    "9": "classe",
    "10": "continuer",
    "11": "définir",
    "12": "supprimer",
    "13": "sinonsi",
    "14": "sinon",
    "15": "sauf",
    "16": "finalement",
    "17": "pour",
    "18": "depuis",
    "19": "global",
    "20": "si",
    "21": "importer",
    "22": "dans",
    "23": "est",
    "24": "lambda",
    "25": "nonlocal",
    "26": "pas",
    "27": "logiqueou",
    "28": "passer",
    "29": "lever",
    "30": "retourner",
    "31": "essayer",
    "32": "tantque",
    "33": "avec",
    "34": "produire"
  }
}
