{
  "version": "1.0.0",
  "languageCode": "de-de",
  "languageName": "Deutsch (Deutschland)",
  "programmingLanguage": "CSharp",
  "translations": {
    "0": "abstrakt",
    "1": "als",
    "2": "basis",
    "3": "boolsch",
    "4": "abbrechen",
    "5": "byte",
    "6": "fall",
    "7": "fangen",
    "8": "zeichen",
    "9": "geprueft",
    "10": "klasse",
    "11": "konstante",
    "12": "fortsetzen",
    "13": "dezimal",
    "14": "standard",
    "15": "delegat",
    "16": "tue",
    "17": "doppelt",
    "18": "sonst",
    "19": "aufzaehlung",
    "20": "ereignis",
    "21": "explizit",
    "22": "extern",
    "23": "falsch",
    "24": "schliesslich",
    "25": "fest",
    "26": "gleitkomma",
    "27": "fuer",
    "28": "fuerjedes",
    "29": "gehezu",
    "30": "wenn",
    "31": "implizit",
    "32": "in",
    "33": "ganzzahl",
    "34": "schnittstelle",
    "35": "intern",
    "36": "ist",
    "37": "sperren",
    "38": "lang",
    "39": "namensraum",
    "40": "neu",
    "41": "null",
    "42": "objekt",
    "43": "operator",
    "44": "ausgabe",
    "45": "ueberschreiben",
    "46": "parameter",
    "47": "privat",
    "48": "geschuetzt",
    "49": "oeffentlich",
    "50": "nurlesbar",
    "51": "referenz",
    "52": "zurueckgeben",
    "53": "vorzeichenbyte",
    "54": "versiegelt",
    "55": "kurz",
    "56": "groessevon",
    "57": "stapelzuweisung",
    "58": "statisch",
    "59": "zeichenkette",
    "60": "struktur",
    "61": "schalter",
    "62": "dieses",
    "63": "werfen",
    "64": "wahr",
    "65": "versuchen",
    "66": "typvon",
    "67": "ganzzahlohnevorzeichen",
    "68": "langohnevorzeichen",
    "69": "ungeprueft",
    "70": "unsicher",
    "71": "kurzohnevorzeichen",
    "72": "verwendend",
    "73": "virtuell",
    "74": "var",
    "75": "leer",
    "76": "fluechtig",
    "77": "solange",
    "78": "asynchron",
    "79": "erwarten",
    "80": "erzeugen",
    "81": "datensatz",
    "82": "teilweise",
    "83": "wo",
    "84": "dynamisch",
    "85": "namevon",
    "86": "initialisierer",
    "87": "erforderlich",
    "88": "global",
    "89": "holen",
    "90": "setzen"
  }
}
