{
  "version": "1.0.0",
  "languageCode": "it-it",
  "languageName": "Italiano (Italia)",
  "programmingLanguage": "VisuAlg",
  "translations": {
    "0": "algoritmo",
    "1": "finealgoritmo",
    "2": "var",
    "3": "inizio",
    "4": "intero",
    "5": "reale",
    "6": "carattere",
    "7": "logico",
    "8": "vettore",
    "9": "scrivi",
    "10": "scriviln",
    "11": "leggi",
    "12": "se",
    "13": "allora",
    "14": "altrimenti",
    "15": "finese",
    "16": "per",
    "17": "da",
    "18": "fino",
    "19": "fai",
    "20": "fineper",
    "21": "mentre",
    "22": "finementre",
    "23": "ripeti",
    "24": "fineripeti",
    "25": "e",
    "26": "oppure",
    "27": "non",
    "28": "div",
    "29": "mod",
    "30": "vero",
    "31": "falso",
    "32": "procedura",
    "33": "fineprocedura",
    "34": "funzione",
    "35": "finefunzione",
    "36": "ritorna",
    "37": "seleziona",
    "38": "caso",
    "39": "altrocaso",
    "40": "fineseleziona",
    "41": "costante",
    "42": "interrompi",
    "43": "xor",
    "44": "puliscischermo",
    "45": "pausa",
    "46": "casuale",
    "47": "debug"
  }
}
