{
  "version": "1.0.0",
  "languageCode": "pt-br-ascii",
  "languageName": "Português (Brasil, ASCII)",
  "programmingLanguage": "PortugolStudio",
  "translations": {
    "0": "inteiro",
    "1": "real",
    "2": "caracter",
    "3": "cadeia",
    "4": "logico",
    "5": "vazio",
    "6": "se",
    "7": "senao",
    "8": "enquanto",
    "9": "faca",
    "10": "para",
    "11": "escolha",
    "12": "caso",
    "13": "contrario",
    "14": "pare",
    "15": "retorne",
    "16": "programa",
    "17": "funcao",
    "18": "const",
    "19": "inclua",
    "20": "biblioteca",
    "21": "e",
    "22": "ou",
    "23": "nao",
    "24": "verdadeiro",
    "25": "falso"
  }
}
