{
  "version": "1.0.0",
  "languageCode": "fr-fr",
  "languageName": "Français (France)",
  "programmingLanguage": "PortugolStudio",
  "translations": {
    "0": "entier",
    "1": "reel",
    "2": "caractere",
    "3": "chaine",
    "4": "booleen",
    "5": "vide",
    "6": "si",
    "7": "sinon",
    "8": "tantque",
    "9": "faire",
    "10": "pour",
    "11": "selon",
    "12": "cas",
    "13": "defaut",
    "14": "rompre",
    "15": "retourner",
    "16": "programme",
    "17": "fonction",
    "18": "const",
    "19": "inclure",
    "20": "bibliotheque",
    "21": "et",
    "22": "ou",
    "23": "non",
    "24": "vrai",
    "25": "faux"
  }
}
