{
  "version": "1.0.0",
  "languageCode": "fr-fr",
  "languageName": "Français (France)",
  "programmingLanguage": "JavaScript",
  "translations": {
    "0": "asynchrone",
    "1": "attendre",
    "2": "arreter",
    "3": "cas",
    "4": "attraper",
    "5": "classe",
    "6": "constante",
    "7": "continuer",
    "8": "defaut",
    "9": "supprimer",
    "10": "faire",
    "11": "sinon",
    "12": "exporter",
    "13": "etend",
    "14": "faux",
    "15": "finalement",
    "16": "pour",
    "17": "fonction",
    "18": "si",
    "19": "importer",
    "20": "dans",
    "21": "instancede",
    "22": "soit",
    "23": "nouveau",
    "24": "nul",
    "25": "retourner",
    "26": "statique",
    "27": "superclasse",
    "28": "choix",
    "29": "ceci",
    "30": "lancer",
    "31": "vrai",
    "32": "essayer",
    "33": "typede",
    "34": "var",
    "35": "vide",
    "36": "tantque",
    "37": "produire"
  }
}