{
  "version": "1.0.0",
  "languageCode": "ar-sa",
  "languageName": "العربية (المملكة العربية السعودية)",
  "programmingLanguage": "VisuAlg",
  "translations": {
    "0": "خوارزمية",
    "1": "نهايةخوارزمية",
    "2": "متغير",
    "3": "بداية",
    "4": "عددصحيح",
    "5": "حقيقي",
    "6": "حرف",
    "7": "منطقي",
    "8": "مصفوفة",
    "9": "اكتب",
    "10": "اكتبسطر",
    "11": "اقرأ",
    "12": "إذا",
    "13": "ثم",
    "14": "وإلا",
    "15": "نهايةإذا",
    "16": "لكل",
    "17": "من",
    "18": "إلى",
    "19": "افعل",
    "20": "نهايةلكل",
    "21": "بينما",
    "22": "نهايةبينما",
    "23": "كرر",
    "24": "نهايةكرر",
    "25": "و",
    "26": "أو",
    "27": "ليس",
    "28": "قسمةصحيحة",
    "29": "باقي",
    "30": "صحيح",
    "31": "كاذب",
    "32": "إجراء",
    "33": "نهايةإجراء",
    "34": "دالة",
    "35": "نهايةدالة",
    "36": "إرجاع",
    "37": "اختر",
    "38": "حالة",
    "39": "حالةأخرى",
    "40": "نهايةاختر",
    "41": "ثابت",
    "42": "قاطع",
    "43": "أوحصري",
    "44": "مسحالشاشة",
    "45": "وقفة",
    "46": "عشوائي",
    "47": "تصحيح"
  }
}
