{
  "version": "1.0.0",
  "languageCode": "en-us",
  "languageName": "English (United States)",
  "programmingLanguage": "CSharp",
  "translations": {
    "0": "abstract",
    "1": "as",
    "2": "base",
    "3": "bool",
    "4": "break",
    "5": "byte",
    "6": "case",
    "7": "catch",
    "8": "char",
    "9": "checked",
    "10": "class",
    "11": "const",
    "12": "continue",
    "13": "decimal",
    "14": "default",
    "15": "delegate",
    "16": "do",
    "17": "double",
    "18": "else",
    "19": "enum",
    "20": "event",
    "21": "explicit",
    "22": "extern",
    "23": "false",
    "24": "finally",
    "25": "fixed",
    "26": "float",
    "27": "for",
    "28": "foreach",
    "29": "goto",
    "30": "if",
    "31": "implicit",
    "32": "in",
    "33": "int",
    "34": "interface",
    "35": "internal",
    "36": "is",
    "37": "lock",
    "38": "long",
    "39": "namespace",
    "40": "new",
    "41": "null",
    "42": "object",
    "43": "operator",
    "44": "out",
    "45": "override",
    "46": "params",
    "47": "private",
    "48": "protected",
    "49": "public",
    "50": "readonly",
    "51": "ref",
    "52": "return",
    "53": "sbyte",
    "54": "sealed",
    "55": "short",
    "56": "sizeof",
    "57": "stackalloc",
    "58": "static",
    "59": "string",
    "60": "struct",
    "61": "switch",
    "62": "this",
    "63": "throw",
    "64": "true",
    "65": "try",
    "66": "typeof",
    "67": "uint",
    "68": "ulong",
    "69": "unchecked",
    "70": "unsafe",
    "71": "ushort",
    "72": "using",
    "73": "virtual",
    "74": "var",
    "75": "void",
    "76": "volatile",
    "77": "while",
    "78": "async",
    "79": "await",
    "80": "yield",
    "81": "record",
    "82": "partial",
    "83": "where",
    "84": "dynamic",
    "85": "nameof",
    "86": "init",
    "87": "required",
    "88": "global",
    "89": "get",
    "90": "set"
  }
}
