{
  "version": "1.0.0",
  "languageCode": "ar-sa",
  "languageName": "العربية (المملكة العربية السعودية)",
  "programmingLanguage": "CSharp",
  "translations": {
    "0": "مجرد",
    "1": "كنوع",
    "2": "أساس",
    "3": "منطقي",
    "4": "توقف",
    "5": "بايت",
    "6": "حالة",
    "7": "التقط",
    "8": "حرف",
    "9": "محقق",
    "10": "صنف",
    "11": "ثابت",
    "12": "استمر",
    "13": "عشري",
    "14": "تلقائي",
    "15": "مفوض",
    "16": "نفذ",
    "17": "مزدوج",
    "18": "وإلا",
    "19": "تعداد",
    "20": "حدث",
    "21": "صريح",
    "22": "خارجي",
    "23": "خطأ",
    "24": "أخيرا",
    "25": "مثبت",
    "26": "عائم",
    "27": "لأجل",
    "28": "لكل",
    "29": "اذهب",
    "30": "إذا",
    "31": "ضمني",
    "32": "في",
    "33": "صحيح",
    "34": "واجهة",
    "35": "داخلي",
    "36": "هو",
    "37": "قفل",
    "38": "طويل",
    "39": "فضاءاسمي",
    "40": "جديد",
    "41": "فارغ",
    "42": "كائن",
    "43": "عامل",
    "44": "خارج",
    "45": "تجاوز",
    "46": "معاملات",
    "47": "خاص",
    "48": "محمي",
    "49": "عام",
    "50": "قراءةفقط",
    "51": "مرجع",
    "52": "أرجع",
    "53": "بايتموقع",
    "54": "مختوم",
    "55": "قصير",
    "56": "حجمه",
    "57": "حجزمكدس",
    "58": "ساكن",
    "59": "نص",
    "60": "هيكل",
    "61": "تبديل",
    "62": "هذا",
    "63": "ارم",
    "64": "صواب",
    "65": "حاول",
    "66": "نوعه",
    "67": "صحيحطبيعي",
    "68": "طويلطبيعي",
    "69": "غيرمحقق",
    "70": "غيرآمن",
    "71": "قصيرطبيعي",
    "72": "باستخدام",
    "73": "افتراضي",
    "74": "متغير",
    "75": "فراغ",
    "76": "متطاير",
    "77": "طالما",
    "78": "غيرمتزامن",
    "79": "انتظر",
    "80": "أنتج",
    "81": "سجل",
    "82": "جزئي",
    "83": "حيث",
    "84": "ديناميكي",
    "85": "اسمه",
    "86": "هيئ",
    "87": "مطلوب",
    "88": "عالمي",
    "89": "جلب",
    "90": "تعيين"
  }
}
