{
  "version": "1.0.0",
  "languageCode": "ar-sa",
  "languageName": "العربية (المملكة العربية السعودية)",
  "programmingLanguage": "JavaScript",
  "translations": {
    "0": "غيرمتزامن",
    "1": "انتظر",
    "2": "توقف",
    "3": "حالة",
    "4": "التقط",
    "5": "صنف",
    "6": "ثابت",
    "7": "استمر",
    "8": "تلقائي",
    "9": "احذف",
    "10": "نفذ",
    "11": "وإلا",
    "12": "صدر",
    "13": "يمتد",
    "14": "خطأ",
    "15": "أخيرا",
    "16": "لأجل",
    "17": "دالة",
    "18": "إذا",
    "19": "استورد",
    "20": "في",
    "21": "نسخةمن",
    "22": "ليكن",
    "23": "جديد",
    "24": "فارغ",
    "25": "أرجع",
    "26": "ساكن",
    "27": "الأصل",
    "28": "تبديل",
    "29": "هذا",
    "30": "ارم",
    "31": "صواب",
    "32": "حاول",
    "33": "نوعه",
    "34": "متغير",
    "35": "فراغ",
    "36": "طالما",
    "37": "أنتج"
  }
}