{
  "version": "1.0.0",
  "languageCode": "it-it",
  "languageName": "Italiano (Italia)",
  "programmingLanguage": "PortugolStudio",
  "translations": {
    "0": "intero",
    "1": "reale",
    "2": "carattere",
    "3": "stringa",
    "4": "logico",
    "5": "vuoto",
    "6": "se",
    "7": "altrimenti",
    "8": "mentre",
    "9": "fai",
    "10": "per",
    "11": "seleziona",
    "12": "caso",
    "13": "predefinito",
    "14": "rompi",
    "15": "ritorna",
    "16": "programma",
    "17": "funzione",
    "18": "const",
    "19": "includi",
    "20": "biblioteca",
    "21": "e",
    "22": "oppure",
    "23": "non",
    "24": "vero",
    "25": "falso"
  }
}
