{
  "version": "1.0.0",
  "languageCode": "ja-jp-romaji",
  "languageName": "Nihongo (Nihon, Romaji)",
  "programmingLanguage": "JavaScript",
  "translations": {
    "0": "hidouki",
    "1": "matsu",
    "2": "tomeru",
    "3": "baai",
    "4": "hokaku",
    "5": "kurasu",
    "6": "teisuu",
    "7": "tsuzukeru",
    "8": "shotei",
    "9": "sakujo",
    "10": "suru",
    "11": "soredemo",
    "12": "yushutsu",
    "13": "keishou",
    "14": "nise",
    "15": "saishuu",
    "16": "kurikaeshi",
    "17": "kansuu",
    "18": "moshi",
    "19": "yunyuu",
    "20": "naka",
    "21": "insutansuno",
    "22": "sengen",
    "23": "atarashii",
    "24": "kara",
    "25": "modoru",
    "26": "seiteki",
    "27": "oyakurasu",
    "28": "sentaku",
    "29": "kore",
    "30": "nageru",
    "31": "shin",
    "32": "tameshi",
    "33": "katano",
    "34": "var",
    "35": "kuuhaku",
    "36": "aidani",
    "37": "seisan"
  }
}