{
  "version": "1.0.0",
  "languageCode": "en-us",
  "languageName": "English (United States)",
  "programmingLanguage": "PortugolStudio",
  "translations": {
    "0": "integer",
    "1": "real",
    "2": "character",
    "3": "string",
    "4": "logical",
    "5": "void",
    "6": "if",
    "7": "else",
    "8": "while",
    "9": "do",
    "10": "for",
    "11": "switch",
    "12": "case",
    "13": "default",
    "14": "break",
    "15": "return",
    "16": "program",
    "17": "function",
    "18": "const",
    "19": "include",
    "20": "library",
    "21": "and",
    "22": "or",
    "23": "not",
    "24": "true",
    "25": "false"
  }
}
