{
  "version": "1.0.0",
  "languageCode": "ja",
  "languageName": "Nihongo Romaji",
  "programmingLanguage": "CSharp",
  "translations": {
    "0": "chuushou",
    "1": "toshite",
    "2": "kiso",
    "3": "shingi",
    "4": "tomeru",
    "5": "baito",
    "6": "baai",
    "7": "hokaku",
    "8": "moji",
    "9": "kensasumi",
    "10": "kurasu",
    "11": "teisuu",
    "12": "tsuzukeru",
    "13": "shousuu",
    "14": "shotei",
    "15": "dairi",
    "16": "suru",
    "17": "nibai",
    "18": "soredemo",
    "19": "rekkyo",
    "20": "ibento",
    "21": "meiji",
    "22": "gaibu",
    "23": "nise",
    "24": "saishuu",
    "25": "kotei",
    "26": "fudoushousuuten",
    "27": "kurikaeshi",
    "28": "subetekurikaeshi",
    "29": "idou",
    "30": "moshi",
    "31": "anji",
    "32": "naka",
    "33": "seisuu",
    "34": "setsuzoku",
    "35": "naibu",
    "36": "dearu",
    "37": "rokku",
    "38": "chouseisuu",
    "39": "meimaikuukan",
    "40": "atarashii",
    "41": "kara",
    "42": "buttai",
    "43": "enzanshi",
    "44": "shutsuryoku",
    "45": "uwagaki",
    "46": "hikisuu",
    "47": "shiyuu",
    "48": "hogo",
    "49": "koukai",
    "50": "yomitorisenyou",
    "51": "sanshou",
    "52": "modoru",
    "53": "fugoutsukibaito",
    "54": "fuuin",
    "55": "tansei",
    "56": "ookisa",
    "57": "sutakkuwariate",
    "58": "seiteki",
    "59": "mojiretsu",
    "60": "kouzoutai",
    "61": "sentaku",
    "62": "kore",
    "63": "nageru",
    "64": "shin",
    "65": "tameshi",
    "66": "katano",
    "67": "fugouseisuu",
    "68": "fugouchouseisuu",
    "69": "mikensa",
    "70": "fuanzen",
    "71": "fugoutansei",
    "72": "shiyou",
    "73": "kasou",
    "74": "var",
    "75": "kuuhaku",
    "76": "kihatsusei",
    "77": "aidani",
    "78": "hidouki",
    "79": "matsu",
    "80": "seisan",
    "81": "kiroku",
    "82": "bubun",
    "83": "dokode",
    "84": "douteki",
    "85": "namaeno",
    "86": "shokika",
    "87": "hissu",
    "88": "zenkyoku"
  }
}
