{
  "version": "1.0.0",
  "languageCode": "ja-jp-romaji",
  "languageName": "Nihongo (Nihon, Romaji)",
  "programmingLanguage": "Python",
  "translations": {
    "0": "nise",
    "1": "nashi",
    "2": "shin",
    "3": "katsu",
    "4": "toshite",
    "5": "dangen",
    "6": "hidouki",
    "7": "matsu",
    "8": "teishi",
    "9": "kurasu",
    "10": "tsuzukeru",
    "11": "teigi",
    "12": "sakujo",
    "13": "soredemonakereba",
    "14": "soredemo",
    "15": "igai",
    "16": "saishuteki",
    "17": "kurikaeshi",
    "18": "kara",
    "19": "zentai",
    "20": "moshi",
    "21": "torikomi",
    "22": "naka",
    "23": "dearu",
    "24": "lambda",
    "25": "higentei",
    "26": "hitei",
    "27": "matawa",
    "28": "toosu",
    "29": "hassei",
    "30": "modoru",
    "31": "kokoromi",
    "32": "aidani",
    "33": "tsukatte",
    "34": "seisan"
  }
}
