{
  "version": "1.0.0",
  "languageCode": "it-it",
  "languageName": "Italiano (Italia)",
  "programmingLanguage": "Python",
  "translations": {
    "0": "falso",
    "1": "nessuno",
    "2": "vero",
    "3": "logicoe",
    "4": "come",
    "5": "affermare",
    "6": "asincrono",
    "7": "attendere",
    "8": "interrompere",
    "9": "classe",
    "10": "continuare",
    "11": "definire",
    "12": "eliminare",
    "13": "altrimse",
    "14": "altrimenti",
    "15": "eccetto",
    "16": "infine",
    "17": "per",
    "18": "da",
    "19": "globale",
    "20": "se",
    "21": "importare",
    "22": "in",
    "23": "è",
    "24": "lambda",
    "25": "nonlocale",
    "26": "non",
    "27": "logicoo",
    "28": "passare",
    "29": "sollevare",
    "30": "ritornare",
    "31": "provare",
    "32": "mentre",
    "33": "con",
    "34": "produrre"
  }
}
