{
  "version": "1.0.0",
  "languageCode": "pt-br-ascii",
  "languageName": "Português (Brasil, ASCII)",
  "programmingLanguage": "CSharp",
  "translations": {
    "0": "abstrato",
    "1": "como",
    "2": "base",
    "3": "booleano",
    "4": "parar",
    "5": "byte",
    "6": "caso",
    "7": "capturar",
    "8": "caractere",
    "9": "verificado",
    "10": "classe",
    "11": "constante",
    "12": "continuar",
    "13": "decimal",
    "14": "padrao",
    "15": "delegado",
    "16": "faca",
    "17": "duplo",
    "18": "senao",
    "19": "enumeracao",
    "20": "evento",
    "21": "explicito",
    "22": "externo",
    "23": "falso",
    "24": "finalmente",
    "25": "fixo",
    "26": "flutuante",
    "27": "para",
    "28": "paracada",
    "29": "vapara",
    "30": "se",
    "31": "implicito",
    "32": "em",
    "33": "inteiro",
    "34": "interface",
    "35": "interno",
    "36": "igual",
    "37": "trancar",
    "38": "longo",
    "39": "espaconome",
    "40": "novo",
    "41": "nulo",
    "42": "objeto",
    "43": "operador",
    "44": "saida",
    "45": "sobrescrever",
    "46": "parametros",
    "47": "privado",
    "48": "protegido",
    "49": "publico",
    "50": "somenteleitura",
    "51": "referencia",
    "52": "retornar",
    "53": "bytesinalizado",
    "54": "selado",
    "55": "curto",
    "56": "tamanhode",
    "57": "alocarnapilha",
    "58": "estatico",
    "59": "texto",
    "60": "estrutura",
    "61": "escolha",
    "62": "este",
    "63": "lancar",
    "64": "verdadeiro",
    "65": "tentar",
    "66": "tipode",
    "67": "inteirossemsinal",
    "68": "longosemsinal",
    "69": "naoverificado",
    "70": "inseguro",
    "71": "curtosemsinal",
    "72": "usando",
    "73": "virtual",
    "74": "var",
    "75": "vazio",
    "76": "volatil",
    "77": "enquanto",
    "78": "assincrono",
    "79": "aguardar",
    "80": "produzir",
    "81": "registro",
    "82": "parcial",
    "83": "onde",
    "84": "dinamico",
    "85": "nomede",
    "86": "inicializador",
    "87": "obrigatorio",
    "88": "global",
    "89": "obter",
    "90": "definir"
  }
}
